Sheet: Sheet1
A1: Location | B1: Description | C1: Poor (hr) | D1: Better (hr) | E1: Actual (hr)
A2: 2.2.3 | B2: Integrate angle calculation into torque analysis | C2: 0 | D2: 24
A3: 2.3.1 | B3: Attractor schematic with dimensions | C3: 2 | D3: 5
A4: 2.3.9 | B4: P-F separation with errorbar | C4: 2 | D4: 5
A5: 2.3.9 | B5: Foil IFO signal as function of press/pos | C5: 5 | D5: 10
A6: 2.3.9 | B6: IFO elaboration | C6: 0 | D6: 5
A7: 2.4.1 | B7: Alignment | C7: 5 | D7: 10
A8: 2.4.1 | B8: Optical alignment number | C8: 0 | D8: 2
A9: 2.4.3 | B9: Pendulum-foil capacitance | C9: 4 | D9: 10
A10: 2.4.3 | B10: Bounce test with moving attractor | C10: 2 | D10: 5
A11: 2.4.4 | B11: Cuts not yet introduced | C11: 1 | D11: 4
A12: 2.5.2.2 | B12: Gas damping numbers | C12: 2 | D12: 4
A13: 2.5.2.3 | B13: Pendulum displacements | C13: 3 | D13: 3
A14: 2.5.2.4 | B14: Flexure nonlinearity | C14: 1 | D14: 4 | E14: 3
A15: 2.5.2.5 | B15: Magnetic systematics | C15: 4 | D15: 10
A16: 2.5.2.5 | B16: Pendulum magnetic moment | C16: 3 | D16: 5
A17: 2.5.2.5 | B17: Thermal currents | C17: 2.5 | D17: 10
A18: 2.5.2.7 | B18: Pneumatic leak rate | C18: 1 | D18: 10 | E18: 2
A19: 2.6.1 | B19: Torque Trace | C19: 1.5 | D19: 3 | E19: 2
A20: 2.6.2 | B20: Noise plot | C20: 1.5 | D20: 3 | E20: 2
A21: 2.6.2 | B21: Flexure motion | C21: 1.5 | D21: 3 | E21: 2
A22: 3.1 | B22: Attractor-side metrology | C22: 5 | D22: 10
A23: 3.2.1 | B23: Horizontal offset | C23: 3 | D23: 5
A24: 3.2.3.2 | B24: Pendulum position photos | C24: 2 | D24: 3
A25: 3.2.3.3 | B25: Assignment of pendulum-foil separation | C25: 2 | D25: 5
A26: 3.3 | B26: Pendulum Angle | C26: 3 | D26: 10
A27: 3.5 | B27: Assignment of a-f separation | C27: 2 | D27: 4
A28: 4.2.1.1 | B28: Torque noise figure | C28: 2 | D28: 4
A29: 4.2.1.4 | B29: Figure not match text, add stuff | C29: 2 | D29: 4
A30: 4.2.2 | B30: Jens doesn't get it | C30: 3 | D30: 5
A31: 4.2.4 | B31: Synchronization | C31: 3 | D31: 12
A32: 4.2.7 | B32: Switches per cut | C32: 2 | D32: 5
A33: 4.3 | B33: Random attractor motion figure | C33: 1.5 | D33: 3
A34: 5.1.2.5 | B34: Cut cross-ref | C34: 0.5 | D34: 1
A35: 5.1.3.3 | B35: Confidence intervals | C35: 10 | D35: 20
A36: 5.2 | B36: Kappa errorbar | C36: 1 | D36: 3
A37: 5.3 | B37: Timing | C37: 2 | D37: 20
A38: 5.4.2 | B38: Denote synchronization offset runs | C38: 2 | D38: 6
A39: 5.4.5 | B39: Clock drift runs | C39: 3 | D39: 5
A40: 5.4.5 | B40: Clock drift sizes | C40: 3 | D40: 5
A41: 5.4.5 | B41: filterHigh WTF | C41: 2 | D41: 4 | E41: 1
A42: 5.5 | B42: Triangle-plot rework | C42: 3 | D42: 16
A43: 7.7 | B43: Q-tester agreement | C43: 2 | D43: 5
A44: 7.8.2 | B44: Verify pendulum offsets | C44: 1 | D44: 3
A45: 7.8.3 | B45: Angled torques | C45: 2 | D45: 8
A46: 7.6 | B46: Random attr alignment | C46: 1 | D46: 3 | E46: 1
A47: 9.2 | B47: Coil/apparatus diagram | C47: 2 | D47: 5
A48: 9.3.1 | B48: Temperature scaling | C48: 3 | D48: 5
A49: 9.3.3 | B49: IFO spot heating | C49: 4 | D49: 8
A50: 10.1 | B50: Foil triangle plot | C50: 2 | D50: 4
A51: 11.2 | B51: Raw data | C51: 5 | D51: 8
A52: 11.3 | B52: Bootstrapped force law | C52: 5 | D52: 12
A53: 11.4.1 | B53: Yukawa caption/description | C53: 3 | D53: 5
A54: 11.4.1 | B54: Yukawa prose | C54: 1 | D54: 2
A55: 12 | B55: Interpretation | C55: 10 | D55: 15
A57: Total: | C57: of:=SUM([.C2:.C55]) -> 140 | D57: of:=SUM([.D2:.D55]) -> 368
A58: 8 hr days | C58: of:=[.C57]/8 -> 17.5 | D58: of:=[.D57]/8 -> 46
A59: Months | C59: of:=[.C57]/8/5/4 -> 0.875 | D59: of:=[.D57]/8/5/4 -> 2.3